บทเรียนคอมพิวเตอร์ช่วยสอนคำศัพท์ภาษาอังกฤษระดับชั้นประถมศึกษาปีที่ 3,Computer assisted instruction of english vocabulary for grade 3,ณัฐปพล,ชูเสน่ห์,มาโนช,ไชยรัตน์,,,จิรพันธุ์ ศรีสมพันธุ์,,,E-PROJECT,ปริญญานิพนธ์ (ค.อ.บ.),CAI,ภาควิชาคอมพิวเตอร์ศึกษา,2553,ปริญญานิพนธ์ฉบับนี้มีวัตถุประสงค์เพื่อสร้างบทเรียนคอมพิวเตอร์ช่วยสอนคําศัพท์ภาษาอังกฤษระดับชึ้นประถมศึกษาปีที่ 3 สําหรับใช้ประกอบการเรียนการสอนวิชา ภาษาอังกฤษโดยเนื้อหาอ้างอิงจากหนังสือเรียนสาระการเรียนรู้พื้นฐานภาษาอังกฤษ ชั้นประถมศึกษาปีที่ 3กลุ่มสาระการเรียนรู้ภาษาต่างประเทศ ตามหลักสูตรการศึกษาขั้นพื้นฐาน พุทธศักราช 2544 ซึ่งประกอบด้วยบทเรียนทั้งหมด 4 บทเรียน ได้แก่บทที่ 1 เรื่อง All about Us บทที่ 2 เรื่อง HomeSweet Home บทที่ 3 เรื่อง Keeping Healthy และบทที่ 4 เรื่อง Good Food พัฒนาบทเรียนด้วยโปรแกรม Adobe Flash CS3 และโปรแกรม Illustrator CS3ผลการดําเนินงานคือบทเรียนคอมพิวเตอร์ช่วยสอนคําศัพท์ภาษาอังกฤษระดับชั้นประถมศึกษาปีที่ 3 ได้ตามขอบเขตของปริญญานิพนธ์ที่กําหนดไว้ทุกประการ
โปรแกรมสร้างสรรค์จินตนาการโดยการสร้างเรื่องราวสำหรับเด็ก,Imaginary Builder Program Through Story Telling for Kids,ถาวร,สืบแสน,ชัชวาล,วงศ์หิรัญเดชา,,,จิรพันธุ์ ศรีสมพันธุ์,,,E-PROJECT,ปริญญานิพนธ์ (ค.อ.บ.),CAI,ภาควิชาคอมพิวเตอร์ศึกษา,2553,"โปรแกรมสร้างสรรค์จินตนาการ โดยการสร้างเรื่องราวสำหรับเด็ก เป็นโปรแกรมที่มี
วัตถุประสงค์เพื่อช่วยให้เด็กได้ฝึกทักษะทางค้านความคิด การฝึกสติปัญญา เพราะเด็กในช่วงวัยนี้
เป็นวัยที่มีความคิดเป็นของตัวเอง เริ่มที่จะมีจินตนาการ ไม่ว่าจะเป็นการสังเกต หรือจดจำสิ่งรอบ
ข้างได้อย่างแม่นขำ นอกจากนี้ยังช่วยฝึกทักษะทางนการสื่อสารของเด็กผ่านทางการพูดอีกด้วย
โปรแกรมสร้างสรรค์จินตนาการ โดยการสร้างเรื่องราวสำหรับเด็ก ประกอบไปด้วย
โปรแกรมย่อย 2 โปรแกรม ได้แก่โปรแกรมสร้างเรื่องราวโดยภาพสำเร็จรูป และ โปรแกมสร้าง
เรื่องราวโดยวาดภาพระบายสิ่ ซึ่งโปรแกมสร้างเรื่องราวโดยภาพสำเร็จรูปนั้นเป็นโปรแกรมที่
สามารถคลิกเลือกภาพที่เตรียมใ ว้ใน'ไลบรรี่มาสร้างเรื่องราว ส่วนโปรแกรมสร้างเรื่องราวโดยวาด
ภาพระบายสี เป็น โปรแกรมที่ให้วาดภาพตามจินตนาการของผู้ใช้โดยใช้เมาส์เป็นอุปกรณ์ในการ
วาดภาพ โปรแกรมสร้างสรรค์จินตนาการโดยการสร้างเรื่องราวสำหรับเด็ก พัฒนาขึ้นโดย
โปรแกรม Adobe Flash CS4 และใช้ Action Script 2.0 ในการควบคุมโปรแกรม
ผลการดำเนินงาน โปรแกรมสร้างสรรค์จินตนาการ โดขการสร้างเรื่องราวสำหรับเด็ก ผู้ใช้ได้
ฝึกทักษะทางค้านความคิด สติปัญญา ในการอธิบายเรื่องราวที่เกิดจากจิบตนาการของผู้ใช้ และ
โปรแกรมสามารถทำงานได้ตามขอบเขตของโครงงานที่กำหนดไว้ทุกประการ"
บทเรียนคอมพิวเตอร์ช่วยสอน แบบปรับเปลี่ยนเนื้อหาตามความสามารถของผู้เรียน วิชาคณิตศาสตร์คอมพิวเตอร์,Adaptive Computer Assisted Instruction in Computer Mathematics,คุณากร,สุทธิกุล,ธนภรณ์,หมอนจันทร์,,,จิรพันธุ์ ศรีสมพันธุ์,,,E-PROJECT,ปริญญานิพนธ์ (ค.อ.บ.),CAI,ภาควิชาคอมพิวเตอร์ศึกษา,2553,"โครงงานเรื่อง บทเรียนคอมพิวเตอร์ช่วยสอน แบบปรับเปลี่ยนเนื้อหาตามความสามารถของ
ผู้เรียน วิชาดณิตศาสตร์คอมพิวเตอร์ จัดทำขึ้นเพื่อสร้างบทเรียนคอมพิวเตอร์ช่วยสอน แบบ
ปรับเปลี่ยนเนื้อหาตามความสามารถของผู้เรียน วิชาคณิตศาสตร์คอมพิวเตอร์ ให้ผู้ใช้บทเรียน
คอมพิวเตอร์ช่วยสอนนี้ใช้ในการสอนเสริม พัฒนาด้วยโปรแกรม Adobe Flash CS4 มีเสียง
ประกอบด้วย เสียงบรรยาย และ เสียงคนตรีประกอบ มีแบบทดสอบ ประกอบด้วย แบบทดสอบ
ก่อนเรียน และ แบบสอบหลังเรียน ภายในบทเรียนแบ่งเป็น 3 ประเภท ได้แก่ บทเรียนสำหรับ
ผู้เรียนเก่ง สำหรับผู้เรียนปานกลาง และสำหรับผู้เรียนอ่อน บทเรียนคอมพิวเตอร์ช่วยสอน
ประกอบคั่วข เนื้อเรื่อง ระบบตัวเลข ระบบเลขฐาน พืชคณิตบูลืน และเซต นำเสนอด้วยสื่อ
มัลติมีเดียตามความแตกต่งระหว่างบุคคล โดยใช้แบบทคสอบก่อนเรียนเป็นเครื่องมือในการแบ่ง
ความสามารถ
ผลการดำเนินงานบทเรียนคอมพิวเตอร์ช่วยสอนบนเว็บ แบบปรับเปลี่ยนเนื้อหาตาม
ความสามารถของผู้เรียน วิชาคณิตศาสตร์คอมพิวเตอร์ ปรากฎว่าสามารถนำไปใช้ในการสอนเสริม
ทบทวนเพิ่มเติมคั่วขตนเองได้จริงตามวัตถุประสงค์และขอบเขตที่กำหนดไว้"
ระบบช่วยจัดตารางสอนผ่านเครือข่ายอินเทอร์เน็ต,Teaching scheduling management system on internet,จันทร์จ้า,พรหมจรรย์,สุภาพร,ชูตระกูลธรรม,,,จิรพันธุ์ ศรีสมพันธุ์,,,E-PROJECT,ปริญญานิพนธ์ (ค.อ.บ.),MIS,ภาควิชาคอมพิวเตอร์ศึกษา,2553,โครงงานนี้มีวัตถุประสงค์เพื่อสร้างระบบจัดตารางสอนผ่านเครือข่ายอินเทอร์เน็ต เป็นโปรแกรมที่สร้างขึ้นมาเพื่อช่วยจดตารางสอนผ่านเครือข่ายอินเทอร์เน็ต มีความสามารถในการคนหาข้อมูล ตารางผู้สอน ตารางห้องเรียน ตารางสอน และผู้ดูแลระบบสามารถที่จะดำเนินการแก้ไข ตารางการเรียนการสอนผ่านทางระบบที่เตรียมไว้การจดทำระบบช่วยจดตารางสอนผ่านเครือข่ายอินเทอร์เน็ต ใช้โปรแกรม Apache Web Server เป็นโปรแกรมที่ให้บริการเว็บพัฒนาระบบโดยภาษา PHP และภาษา JavaScript ใช้ MySQL เป็นฐานข้อมูลผลการดำเนินงาน ได้ระบบช่วยจดตารางสอนผ่านเครือข่ายอินเทอร์เน็ตที่มีความสามารถตามขอบเขตที่ตั้งไว้ผลการทดสอบจากผู้ใช้ สามารถใช้งานได้ เป็นอย่างดี
โปรแกรมช่วยจัดทำหนังสืออนุสรณ์,Wizard of the letter memorial program,ทวีศักดิ์,ปฐพีเลิศสุวรรณ,ณฐพร,สิทธิชัย,,,จิรพันธุ์ ศรีสมพันธุ์,,,E-PROJECT,ปริญญานิพนธ์ (ค.อ.บ.),SW,ภาควิชาคอมพิวเตอร์ศึกษา,2553,โปรแกรมช่วยจัดทําหนังสืออนุสรณ์มีวัตถุประสงค์เพื่อพัฒนาโปรแกรมช่วยจัดทําหนังสืออนุสรณ์ โดยมีขอบเขตดังนี้สามารถแก้ไข ค้นหารายชื่อบัณฑิตที่จบภายในปีเดียวกันได้สามารถนําข้อมูลจากฐานข้อมูลไปใช้ในการจัดทําหนังสืออนุสรณ์ได้โดยส่งออกในรูปแบบของไฟล์ XML ผลการดําเนินงานสร้างโปรแกรมช่วยจัดทําหนังสืออนุสรณ์บัณฑิต ได้เป็นไปตามขอบเขตที่ได้กําหนดไว้โดยโปรแกรมแบ่งออกเป็น 2 ส่วน ได้แก่ส่วนของการจัดการฐานข้อมูล ซึ่งข้อมูลทจัดเก็บประกอบไปด้วย รหัสนักศึกษา คํานําหน้าชื่อ ชื่อ นามสกุล ระดับการศึกษา รหัสคณะชื่อสาขาวิชารหัสภาควิชา ชื่อย่อภาควิชารหัสบัตรประชาชน ที่อยู่เบอร์โทรศัพท์เบอร์มือถืออีเมล์ภาพ ส่วนของการนําเสนอหนังสืออนุสรณ์ด้วยโปรแกรม Adobe Flash CS4 จะทําการดึงข้อมูลจากส่วนของไฟล์ XML มาแสดงผล ตามรูปแบบของหนังสืออนุสรณ์บัณฑิต โปรแกรมสามารถอํานวยความสะดวกและเป็นประโยชน์ต่อเจ้าหน้าที่ในการจัดทําหนังสืออนุสรณ์ต่อไป
สื่อการเรียนรู้เชิงวัตถุ เรื่อง ภูมิศาสตร์ จังหวัดนนทบุรี ชั้นประถมศึกษาปีที่ 4,Learning object geography : Nonthaburi for primary level 4 student,เกียรติกมล ,เกลี้ยงเกลา,นิภา,ทะขัด,,,จิรพันธุ์ ศรีสมพันธุ์,,,E-PROJECT,ปริญญานิพนธ์ (ค.อ.บ.),CAI,ภาควิชาคอมพิวเตอร์ศึกษา,2554,สื่อการเรียนรู้เชิงวัดถุ เรื่อง ภูมิศาสตร์ จังหวัดนนทบุรี ชั้นประถมศึกษาปีที่ 4 จัดทำขึ้นเพื่อเป็นสื่อการเรียนการสอนและแหล่งเรียนรู้วิชาภูมิศาสตร์ ตามหลักสูตรแกนกลางการศึกษาขั้นพื้นฐาน พุทธศักราช 2551 ในสาระที่ 4 สำหรับคณะครู - อาจารย์ และบุคคลทั่วไปที่มีความสนใจสื่อการเรียนรู้เชิงวัตถุ เรื่อง ภูมิศาสตร์ จังหวัดนนทบุรี ชั้นประถมศึกษาปีที่ 4 ประกอบด้วยสื่อการเรียนรู้เชิงวัตถุจำนวน 10 ชุด ได้แก่ สื่อการเรียนรู้ เรื่อง สัญลักษณ์ประจำจังหวัดนนทบุรี สื่อการเรียนรู้ เรื่อง ที่ตั้งและอาณาเขตของจังหวัดนนทบุรี สื่อการเรียนรู้ เรื่อง ภูมิประเทศของจังหวัดนนทบุรี สื่อการเรียนรู้ เรื่อง ภูมิอากาศของจังหวัดนนทบุรี สื่อการเรียนรู้ เรื่อง การคมนาดมของจังหวัดนนทบุรี สื่อการเรียนรู้ เรื่อง การปกครองส่วนภูมิภาคของจังหวัดนนทบุรี สื่อการเรียนรู้เรื่อง อาชีพประชากรของจังหวัดนนทบุรี สื่อการเรียนรู้ เรื่อง ศาสนาที่ประชากรจังหวัดนนทบุรีนับถือ สื่อการเรียนรู้ เรื่อง ประเพณีตักบาตรพระร้อยแปดของจังหวัดนนทบุรี และสื่อการเรียนรู้ เรื่องสถานที่สำคัญของจังหวัดนนทบุรี จากการทดสอบการทำงานของสื่อการเรียนรู้พบว่าสื่อการเรียนรู้สามารถใช้งานตรงตามวัตถุประสงค์และขอบเขตของโครงงานที่กำหนดไว้ทุกประการ
การพัฒนาบทเรียนคอมพิวเตอร์ช่วยสอน เรื่อง การฝึกวาดการ์ตูน,A development CAI for cartoon drawing practice,เบญจวรรณ ,มูลยะเทพ,,,,,จิรพันธุ์ ศรีสมพันธุ์,,,E-PROJECT,ปริญญานิพนธ์ (ค.อ.บ.),CAI,ภาควิชาคอมพิวเตอร์ศึกษา,2554,"การพัฒนาบทเรียนคอมพิวเตอร์ช่วยสอน ""การฝึกวาดการ์ตูน"" นำเสนอในรูปแบบบทเรียนคอมพิวเตอร์ โดยมีภาพนิ่ง ภาพเคลื่อนไหวสองมิติ เสียงบรรยาย ดนตรี ภายในบทเรียนประกอบด้วยเนื้อหาที่เป็นการสอนวาดการ์ตูนตามลำดับ จำนวน 5 เรื่อง คือ เตรียมความพร้อมก่อนลงมือวาด การวาดโครงสร้าง-สัดส่วนของตัวการ์ตูน องค์ประกอบโดยรวมบนใบหน้าของตัวการ์ตูน การวาดอารมณ์ของตัวการ์ตูน และข้อควรระวังในการวาดการ์ตูน ซึ่งแต่ละเรื่องมีเรื่องย่อยเรียงจากง่ายไปหายาก และมีการสาธิตการวาด อีกทั้งกิจกรรมให้วาดตามเส้นประ โดยมีการตรวจทานให้คะแนนในการวาด ซึ่งเนื้อหาทั้งหมดได้คัดมาจากหนังสือการฝึกวาดการ์ตูนโดยคัดเลือกเนื้อหาการวาดการ์ตูนที่เป็นพื้นฐานเบื้องต้นที่สามารถนำความรู้นั้น มาปฏิบัติวาดได้จริง ส่วนการทำงานของบทเรียนมีการปฏิสัมพันธ์กับผู้เรียน โดยให้ผู้เรียนเลือกเรื่องที่ต้องการเรียน ส่วนหน้าจอแสดงผลได้ออกแบบให้ง่ายต่อการสื่อสารกับผู้เรียน ซึ่งมีการเชื่อมโยงบทเรียนใช้โปรแกรม Adobe Flash CS4 และการบันทึก แก้ไขเสียงอธิบาย รวมทั้งดนตรีประกอบใช้โปรแกรม Adobe Auditionการทำงานของโปรแกรม สามารถทำงานภายใต้ระบบปฏิบัติการ Windows XP หรือสูงกว่า มีการ์ดเสียงพร้อมลำโพง มีตัวขับซีดี มีการติดต่อผ่านทางเมาส์และปากกาอิเล็กทรอนิกส์ซึ่งบทเรียนนี้ถูกบรรจุอยู่ในแผ่นชีดีรอม จากการทดสอบการทำงานของบทเรียนพบว่ ทำงานได้ตามวัตถุประสงค์ และขอบเขตของโครงงานที่กำหนดไว้"
