การพัฒนาระบบสนับสนุนการตัดสินใจเพื่อประเมินสถานะความเข้มแข็งของชุมชนด้านยาเสพติดโดยใช้เทคนิคการทำเหมืองข้อมูล(กรณีศึกษา: สำนักงานคณะกรรมการป้องกันและปราบปรามยาเสพติด),The Development a Decision Support System for the Community Power Evaluation on Drug Prevention using Data Mining Technique,วาสิฏฐี,มุสิกะพันธ์,,,,,ธัญญรัตน์ น้อมพลกรัง,,,E-PROJECT,ปริญญานิพนธ์ (ค.อ.บ.),MIS,ภาควิชาคอมพิวเตอร์ศึกษา,2559,"งานวิจัยนี้ มีวัตถุประสงค์เพื่อการพัฒนาระบบสนับสนุนการตัดสินใจด้านการประเมิน
สถานะความเข้มแข็งของชุมชนด้านยาเสพติด เพื่อใช้ในการวางแผนการต่อต้านปัญหาด้านยาเสพ
ติด โดยประเมินจากการกิจกรรมส่งเสริมความเข้มแข็งของชุมชน ที่ทางสำนักงานคณะกรรมการ
ป้องกันและปราบปรามยาเสพติด โดยตัวแบบที่ใช้การทำนายผลการเปลี่ยนแปลงของระดับความ
เข้มแข็งได้มาจากกระบวนการทำเหมืองข้อมูล มาสร้างตัวแบบในการทำนายระดับความเข้มแข็ง
และนำข้อมูลมาทำการสร้างตัวแบบด้วยอัลกอริทึม 3 อัลกอริทีม คือ 1) Decision Tree 2)
Naive Baye และ Neural Network โดยทำการเปรียบอัลกอริทีมที่ใช้สร้างตัวแบบ 3 อัลกอริทีมคือ 1)
Decision Tree 2) Naive Baye และ Neural Network พว่าอัลกอริทีมแบบ Decision Tree  มี
ประสิทธิภาพดีที่สุดคือ ร้อยละ 87.06 รองลงมาคือ Naive Baye ร้อยละ 81.92 และ Neural
Network ร้อยละ 81.78 ตามลำดับ สำหรับระบบสนับสนุนการตัดสินใจ พัฒนาตาม
กระบวนการของ SDLC โดยนำตัวแบบที่ได้ไปใช้ในระบบสนับสนุนการตัดสินใจ เพื่อให้ระบบ
สามารถพยากรณ์แนวโน้มระดับความเข้มแข็งของชุมชน พร้อมทั้งนำเสนอข้อมูลในกราฟฟิก
เพื่อให้ง่ายต่อการทำความเข้าใจ
ซึ่งผลจากการประเมินประสิทธิภาพของระบบโดยผู้เชี่ยวชาญมีค่าเฉลี่ยเท่ากับ 4.25 และ
ส่วนเบี่ยงเบนมาตรฐานอยู่ที่ 0.49 ซึ่งระบบมีประสิทธิภาพอยู่ในระดับดี และการประเมินความ
พึงพอใจต่อการใช้ระบบมีค่าเฉลี่ยเท่ากับ 4.50 และส่วนเบี่ยงเบนมาตรฐานอยู่ที่ 0.54 ซึ่งเป็น
ความพึ่งพอใจในระดับดีมาก"
การพัฒนาระบบสืบคั้นเชิงความหมาย สำหรับงานประกันคุณภาพการศึกษา กรณีศึกษา หลักสูตรครุศาสตร์อุตสาหกรรมบัณฑิตสาขาวิชาเทคโนโลยีคอมพิวเตอร์,The Development of Semantic Information Retrieval System for Quality Assurance in Education: A Case Study in Bachelor of Science in Technical Education Program in Computer Technology,ธีระ,ทองสุวรรณ,สุพัตรา,ชัยทารินทร์,,,ธัญญรัตน์ น้อมพลกรัง,,,E-PROJECT,ปริญญานิพนธ์ (ค.อ.บ.),MIS,ภาควิชาคอมพิวเตอร์ศึกษา,2561,"ปริญญานิพนธ์ฉบับนี้ได้นำเสนอเทคโนโลยีออนโทโลยีมาใช้ในการออกแบบโครงสร้าง
ฐานความรู้การพัฒนาระบบสืบคันเชิงความหมาย สำหรับงานประกันคุณภาพการศึกษา กรณีศึกษา
หลักสูตรครุศาสตร์อุตสาหกรรมบัณฑิต สาขาวิชาเทคโนโลยีคอมพิวเตอร์ เนื่องจากพบว่าหลักสูตร
ของระบบ CUPT QA ใช้เกณฑ์ ASEAN University Network - Quality Assurance (AUN-QA) ซึ่ง
เป็นเกณฑ์ระดับสากลที่มีสาระหลักเกี่ยวกับการจัดการศึกษา เน้นการพัฒนาที่มุ่งสัมฤทธิ์สู่ Expected
Learning Outcome (ELO) เพื่อให้สอดคล้องกับการเปลี่ยนแปลงอย่างรวดเร็วของเทคโนโลยี งาน
ประกันคุณภาพต้องคำนึงถึงและทำให้มั่นใจว่าบัณฑิตจากหลักสูตรหนึ่งๆ จะได้รับความรู้และการ
พัฒนาทักษะที่เป็นประโยชน์เพื่อใช้ในการประกอบอาชีพภายหลังจบกรศึกษา จึงได้มีการนำออน
โทโลยีมาเชื่อมโยงคำที่เป็นเชิงความหมายเพื่อให้สามารถสืบค้นข้อมูลเชิงความหมายได้ ให้ผู้ใช้งาน
สามารถคันหาข้อมูลจากความสัมพันธ์ของผลการเรียนรู้ที่คาดหวัง รายวิชา และอาชีพหลังสำเร็จ
หลักสูตร โดยมีขั้นตอนการพัฒนาระบบ 5 ขั้นตอนตามหลักการออกแบบของ ADDIE Model คือ
1) ศึกษาและรวบรวมข้อมูล โดยรวบรวมข้อมูลรายวิชา ผลการเรียนรู้ที่คาดหวัง และอาชีพจาก
หลักสูตรและเอกสารที่เกี่ยวข้อง 2) วิเคราะห์และออกแบบระบบ ออนโทโลยีด้วยโปรแกรม Protege
5.0 3) การพัฒนาระบบ 4) การนำไปทดลองใช้งาน และ 5) การประเมินผลการใช้งานระบบ โดย
วัดค่าความแม่นยำในการสืบคั้นเท่ากับ 100% มีความถูกต้องตามโครงสร้างออนโทโลยีและสัมพันธ์
กับฐานข้อมูล"
การพัฒนาบทเรียนคอมพิวเตอร์ช่วยสอนแบบทบทวนบนเครือข่ายอินเทอร์เน็ต รายวิชาจริยธรรมในอาชีพคอมพิวเตอร์ หลักสูตรประกาศนียบัตรวิชาชีพ,"The Development of Drill and Practice Web-Based Instruction on Ethics in Computer Profession, Vocational Certificate Level",นายศิริพล,แสนบุญส่ง,,,,,ธันว์รัชต์ สินธนะกุล,,,E-PROJECT,ปริญญานิพนธ์ (ค.อ.บ.),CAI,ภาควิชาคอมพิวเตอร์ศึกษา,2555,การวิจัยครั้งนี้มีวัตถุประสงค์ เพื่อพัฒนาและหาประสิทธิภาพของบทเรียนคอมพิวเตอร์ช่วยสอนแบบทบทวนบนเครือข่ายอินเทอร์เน็ต รายวิชาจริยธรรมในอาชีพคอมพิวเตอร์ หลักสูตรประกาศนียบัตรวิชาชีพ เพื่อเปรียบเทียบผลสัมฤทธิ์ทางการเรียนก่อนเรียนและหลังเรียนของผู้เรียนที่เรียนด้วยบทเรียนคอมพิวเตอร์ช่วยสอนที่ผู้วิจัยพัฒนาขึ้น และประเมินความพึงพอใจของผู้เรียนที่มีต่อบทเรียนที่ผู้วิจัยพัฒนาขึ้น กลุ่มตัวอย่างที่ใช้ในการวิจัยเป็นนักเรียนระดับประกาศนียบัตรวิชาชีพภาคเรียนที่ 2 ปีการศึกษา 2555 วิทยาลัยเทคนิคปทุมธานี จำนวน 30 คน คัดเลือกโดยวิธีสุ่มอย่างง่าย เครื่องมือที่ใช้ในการวิจัยครั้งนี้ประกอบด้วย บทเรียนคอมพิวเตอร์ช่วยสอนแบบทบทวนแบบทดสอบก่อนเรียน แบบทดสอบหลังเรียน และแบบสอบถามความพึงพอใจผลการวิจัยพบว่าบทเรียนคอมพิวเตอร์ช่วยสอนที่พัฒนาขึ้นมีประสิทธิภาพเท่ากับ 1.34 ตามสูตรของเมกุยแกนส์ ซึ่งเป็นไปตามสมมติฐานที่ตั้งไว้ ผลสัมฤทธิ์ทางการเรียนของผู้เรียนด้วยบทเรียนคอมพิวเตอร์ช่วยสอนแบบทบทวนหลังเรียนสูงกว่าก่อนเรียนอย่างมีนัยสำคัญทางสถิติที่ .05 และผู้เรียนมีความพึงพอใจในการเรียนด้วยบทเรียนคอมพิวเตอร์ช่วยสอนแบบทบทวนที่พัฒนาขึ้นในระดับมาก สรุปว่าบทเรียนคอมพิวเตอร์ช่วยสอนแบบทบทวนบนเครือข่ายอินเทอร์เน็ตที่พัฒนาขึ้นสามารถนำไปใช้ประกอบในการเรียนการสอน รายวิชาจริยธรรมในอาชีพคอมพิวเตอร์ได้
การพัฒนาบทเรียนคอมพิวเตอร์ช่วยสอนแบบทบทวนบนเครือข่ายอินเทอร์เน็ต เรื่องระบบตัวเลข วิชาคณิตศาสตร์คอมพิวเตอร์,The Development of the Drill and Practice Web-Based Instruction on “Binary System” for Computer Mathematics Course,นางสาววิมลฉวี,แซ่เลื่อง,,,,,ธันว์รัชต์ สินธนะกุล,,,E-PROJECT,ปริญญานิพนธ์ (ค.อ.บ.),CAI,ภาควิชาคอมพิวเตอร์ศึกษา,2555,การวิจัยนี้มีวัตถุประสงค์เพื่อพัฒนาและหาประสิทธิภาพบทเรียนคอมพิวเตอร์ช่วยสอนแบบทบทวนบนเครือข่ายอินเทอร์เน็ต เรื่องระบบตัวเลข วิชาคณิตศาสตร์คอมพิวเตอร์ เปรียบเทียบผลสัมฤทธิ์ทางการเรียนของผู้เรียนก่อนเรียนและหลังเรียนด้วยบทเรียนคอมพิวเตอร์ช่วยสอน และประเมินความพึงพอใจของผู้เรียนในการใช้บทเรียนคอมพิวเตอร์ช่วยสอนที่พัฒนาขึ้นกลุ่มตัวอย่างที่ใช้ในการทดลองครั้งนี้ เป็นนักเรียนที่เรียนวิชาคณิตศาสตร์คอมพิวเตอร์ ชั้นปวช.2แผนกวิชาคอมพิวเตอร์ธุรกิจ โดยเลือกนักเรียนกลุ่มตัวอย่างแบบเจาะจง จำนวน 20 คน เครื่องมือที่ใช้ในการวิจัยครั้งนี้ประกอบด้วยบทเรียนคอมพิวเตอร์ช่วยสอนที่สร้างขึ้น แบบทดสอบวัดผลสัมฤทธิ์ทางการเรียนของผู้เรียน และแบบประเมินความพึงพอใจของผู้เรียนผลการวิจัยพบว่า บทเรียนคอมพิวเตอร์ที่สร้างขึ้นมีประสิทธิภาพตามเกณฑ์ของเมกุยแกนส์เท่ากับ 1.11 ผลสัมฤทธิ์ทางการเรียนของผู้เรียนหลังเรียนสูงกว่าก่อนเรียนอย่างมีนัยสำคัญทางสถิติที่ระดับ .05 และความพึงพอใจของผู้เรียนที่มีต่อบทเรียนคอมพิวเตอร์ช่วยสอนอยู่ในระดับมากที่สุด
การพัฒนาบทเรียนคอมพิวเตอร์ช่วยสอนแบบทบทวนบนเครือข่ายอินเทอร์เน็ต วิชา Database and Design,The Development of Drill and Practice Web-based Instruction on Database and Design,นางสาวณัฐภรณ์,เพ็งเลีย,,,,,ธันว์รัชต์ สินธนะกุล,,,E-PROJECT,ปริญญานิพนธ์ (ค.อ.บ.),CAI,ภาควิชาคอมพิวเตอร์ศึกษา,2555,ปัญหาพิเศษนี้มีวัตถุประสงค์เพื่อพัฒนาและหาประสิทธิภาพบทเรียนคอมพิวเตอร์ช่วยสอนแบบทบทวนบนเครือข่ายอินเทอร์เน็ต วิชา Database and  Design  และเปรียบเทียบผลสัมฤทธิ์ทางการเรียนของผู้เรียนก่อนเรียนและหลังเรียนด้วยบทเรียนคอมพิวเตอร์ช่วยสอนที่พัฒนาขึ้นเครื่องมือที่ใช้ในการวิจัยครั้งนี้ประกอบด้วยบทเรียนคอมพิวเตอร์ช่วยสอนผ่านระบบเครือข่ายที่สร้างขึ้น และแบบทดสอบวัดผลสัมฤทธิ์ทางการเรียนของผู้เรียน กลุ่มตัวอย่างที่ใช้ในการทดลองครั้งนี้ เป็นนักศึกษาที่เรียนวิชา Database and Design ระดับปริญญาตรีปีที่ 2 ปีการศึกษา 2555สาขาการจัดการเทคโนโลยีการผลิตและสารสนเทศ มหาวิทยาลัยเทคโนโลยีพระจอมเกล้าพระนครเหนือ โดยเลือกนักเรียนกลุ่มตัวอย่างแบบเจาะจง จำนวน 30 คนผลการวิจัยพบว่า บทเรียนคอมพิวเตอร์ช่วยสอนแบบทบทวนที่พัฒนาขึ้นมีประสิทธิภาพตามเกณฑ์ของเมกุยแกนส์ เท่ากับ 1.62 และผลสัมฤทธิ์ทางการเรียนของผู้เรียนหลังเรียนสูงกว่าก่อนเรียนอย่างมีนัยสำคัญทางสถิติที่ระดับ . 05 สรุปว่าบทเรียนคอมพิวเตอร์ช่วยสอนแบบทบทวนบนเครือข่ายอินเทอร์เน็ตที่พัฒนาขึ้นสามารถนำไปใช้ประกอบในการเรียนการสอน วิชา Databaseand Design ได้
การพัฒนาบทเรียนคอมพิวเตอร์ช่วยสอนบนระบบเครือข่ายอินเทอร์เน็ต แบบสาธิต เรื่องหนังสือราชการประเภทต่าง ๆ วิชาโปรแกรมประมวลผลคำประยุกต์,The Development of Web-Based Instruction on Official Letters in Word Processing Application Subject using Demonstration Technique,นางสาวเพ็ญพร,ใจเย็น,,,,,ธันว์รัชต์ สินธนะกุล,,,E-PROJECT,ปริญญานิพนธ์ (ค.อ.บ.),CAI,ภาควิชาคอมพิวเตอร์ศึกษา,2555,จุดประสงค์ของการวิจัยครั้งนี้เพื่อ 1) พัฒนาบทเรียนคอมพิวเตอร์ช่วยสอนบนระบบเครือข่ายอินเทอร์เน็ตแบบสาธิต เรื่องหนังสือราชการประเภทต่าง ๆ วิชาโปรแกรมประมวลผลคำประยุกต์2) หาประสิทธิภาพของบทเรียนคอมพิวเตอร์ช่วยสอนบนระบบเครือข่ายอินเทอร์เน็ต 3) เปรียบเทียบผลสัมฤทธิ์ทางการเรียนของผู้เรียนก่อนเรียนและหลังเรียนด้วยบทเรียนคอมพิวเตอร์ช่วยสอนบนระบบเครือข่ายอินเทอร์เน็ต และ 4) ประเมินคุณภาพผลงานของผู้เรียนหลังจากเรียนรู้จากบทเรียนคอมพิวเตอร์ช่วยสอนบนระบบเครือข่ายอินเทอร์เน็ต กลุ่มตัวอย่างที่ใช้ในการวิจัยครั้งนี้เป็นนักศึกษาระดับประกาศนียบัตรวิชาชีพ ชั้นปีที่ 2 สาขาวิชาคอมพิวเตอร์ธุรกิจ วิทยาลัยสารพัดช่างบรรหาร-แจ่มใสภาคเรียนที่ 2/2555 คัดเลือกโดยใช้วิธีการสุ่มแบบเจาะจง จำนวน 20 คน เครื่องมือที่ใช้ในการวิจัยได้แก่ บทเรียนคอมพิวเตอร์ช่วยสอนบนระบบเครือข่ายอินเทอร์เน็ต แบบประเมินคุณภาพของบทเรียนคอมพิวเตอร์ช่วยสอน แบบประเมินผลสัมฤทธิ์ทางการเรียนของผู้เรียนก่อนเรียนและหลังเรียนด้วยบทเรียนคอมพิวเตอร์ช่วยสอนบนระบบเครือข่ายอินเทอร์เน็ต และแบบประเมินคุณภาพผลงานของผู้เรียนหลังจากเรียนรู้จากบทเรียนคอมพิวเตอร์ช่วยสอนบนระบบเครือข่ายอินเทอร์เน็ต สถิติที่ใช้ในการวิจัย ได้แก่ การหาประสิทธิภาพของบทเรียนคอมพิวเตอร์ช่วยสอนตามทฤษฎีของเมกุยแกนส์การวิเคราะห์เปรียบเทียบผลสัมฤทธิ์ทางการเรียนก่อนและหลังเรียน (t-test) การหาค่าเฉลี่ย (Mean)และค่าส่วนเบี่ยงเบนมาตรฐาน (S.D.)ผลการวิจัยพบว่า 1) บทเรียนดังกล่าวมีประสิทธิภาพเท่ากับ 2.26 ซึ่งสูงกว่า 1.00 จึงถือว่าบทเรียนมีประสิทธิภาพตามเกณฑ์มาตรฐานของเมกุยแกนส์ 2) ผลสัมฤทธิ์ทางการเรียนหลังเรียนสูงกว่าก่อนเรียน อย่างมีนัยสำคัญทางสถิติที่ระดับ .05 3) ผลการประเมินคุณภาพผลงานของผู้เรียน อยู่ในระดับดี ดังนั้นสรุปได้ว่าบทเรียนคอมพิวเตอร์ ช่วยสอนบนระบบเครือข่ายอินเทอร์เน็ตที่พัฒนาขึ้นสามารถนำไปใช้เป็นสื่อการสอนให้ผู้เรียนที่มีความรู้ในการใช้คอมพิวเตอร์ที่แตกต่างกันได้เป็นอย่างดี
