การพัฒนาเว็บไซต์งานกิจการนักศึกษา คณะครุศาสตร์อุตสาหกรรม มหาวิทยาลัยพระจอมเกล้าพระนครเหนือ,A development of student activities affairs website for the Faculty of Technical Education King Mongkut's University of Technology North Bangkok,เบญจวรรณ,ชื่นสกุล,ธนวรรณ ,แสนคำ,,,วิทวัส ทิพย์สุวรรณ,,,E-PROJECT,ปริญญานิพนธ์ (ค.อ.บ.),WBI,ภาควิชาคอมพิวเตอร์ศึกษา,2551,เว็บไซต์งานกิจการนักศึกษา คณะครุศาสตร์อุตสาหกรรม พัฒนาขึ้นเพื่อช่วยอํานวยความสะดวกให้กับเจ้าหน้าที่งานกิจการนักศึกษา อาจารย์แต่ละภาควิชาที่เกี่ยวข้องในเรื่องการเสนอโครงการให้ฝ่ายกิจการนักศึกษา โดยสามารถเสนอโครงการ และติดตามผลโครงการผ่านทางระบบงานบนเว็บไซต์ได้อย่างสะดวก รวมถึงนักศึกษาคณะครุศาสตร์อุตสาหกรรมสามารถรับรู้ข่าวสารความเคลื่อนไหวในด้านต่างๆ ไม่ว่าจะเป็นข่าวกิจกรรมหรือโครงการประจําปีการศึกษาระเบียบหรือคําสั่งต่างๆ ข่าวประกาศเกี่ยวกับทุนการศึกษา รวมถึงการแสดงความคิดเห็นผ่านทางกระดานถามตอบ ผ่านกระบวนการทํางานบนเว็บไซต์เว็บไซต์พัฒนาขึ้นสําหรับใช้งานบนอินเทอร์เน็ตมีโปรแกรม MySQL ในการจัดการฐานข้อมูล ทํางานรวมกับภาษา PHP ซึ่งสามารถทํางานภายใต้ระบบปฏิบัติการ Windows ที่ใช้งานโปรแกรมเว็บบราวเซอร์ ซึ่งเป็นตัวแสดงผล โดยจะเน้นที่โปรแกรม Microsoft Internet Explorerเป็นหลักจากการทดสอบการทํางานของเว็บไซต์ พบว่าสามารถทํางานได้ตามวัตถุประสงค์และขอบเขตของโครงงานที่กําหนดไว้ แต่ยังมีงานบางส่วนที่ต้องได้รับการพัฒนาต่อไป ได้แก่การแจ้งเตือนอัตโนมัติผ่านระบบ SMSไปยังผู้เสนอโครงการเมื่อได้รับการอนุมัติจากเจ้าหน้าที่แล้วควรมีการประมวลภาพกิจกรรมในรูปแบบของไฟล์วีดีโอ และควรมีระบบช่วยในการปรึกษาโครงการเพื่อตรวจสอบความถูกต้องก่อนเสนอไปยังเจ้าหน้าที่ฝ่ายกิจการนักศึกษา เพื่อให้เป็นเว็บไซต์ที่สามารถรองรับการบริหารภายใต้ระบบงานของงานกิจการนักศึกษา และมีประสิทธิภาพในการใช้งานมากยิ่งขึ้น
ระบบเตือนภัยการโจรกรรมรถนต์ด้วยโทรศัพท์มือถือ,CAR THEFT ALERT SYSTEM USING MOBILE,บัณฑิต,พิมพากรณ์,นฤมล,ธัญญะประเสริฐศิริ,,,วิทวัส ทิพย์สุวรรณ,,,E-PROJECT,ปริญญานิพนธ์ (ค.อ.บ.),MIS,ภาควิชาคอมพิวเตอร์ศึกษา,2552,"โครงงานระบบเตือนภัยการโจรกรรมรถยนค์ด้วยโทรศัพท์มือถือ จัดทำขึ้นเพื่อนำเอา
โทรศัพท์มือถือและ GPS มาประยุกต์กับระบบสัญญาณกันขโมยเพื่อช่วยเพิ่มประสิทธิภาพของ
ระบบเตือนภัย ใช้โมโครคอนโทรลเลอร์ PIC1 8F8722 ติดต่อกับอุปกรณ์ GSM Module รุ่น ET
GSM SIM300CZ, GPS Module รุ่น GR-82, ZX-PIR Motion Detector และใช้ Switch เป็นตัว
จำลองในการเปิดกระโปรงหน้าและกระโปรงหลังรถยนต์ ภายในไมโครคอนโทรลเลอร์มีฟังก็ชั่นที่
ใช้สำหรับติดต่ออุปกรณ์ต่าง ๆ โดยใช้ CCS C คอมไพเลอร์ในการโปรแกรม
ผลการทดสอบการทำงานปรากฏว่าระบบเตือนภัยนี้สามารถใช้โทรศัพท์มือถือสั่งงานเพื่อ
เปิดหรือปีดระบบเตือนภัย โดยเมื่อเกิดการโจรกรรมรถยนต์ ส่วนอุปกรณ์รับรู้ (Sensor Module) ส่ง
คำสั่งให้ส่วนการประมวลผล (Processing Module) เพื่อทำการตัดระบบไฟเลี้ยงวงจรสตาร์ทกับ
วงจร EcU และส่วนสื่อสารกับระบบโทรศัพท์มือถือ (GSM Module) ทำการส่งข้อความแจ้ง
ตำแหน่งที่ถูกบุกรุกพร้อมทั้งระบุพิกัตำแหน่งรถนต์ (ละติจูดและลองจิจุด)  ที่ได้จากส่วนรับ
สัญญาณดาวเทียม (GPS Module) ไปขังโทรศัพท์มือถือของเจ้าของรถยนต์ได้ตามขอบเขตของ
ปริญญานิพนธ์ที่กำหนดไว้ทุกประการ
โครงงานนี้สามารถพัฒนาส่วนสื่อสารกับระบบโทรศัพท์มือถือให้รองรับเทคโนโลยี
โทรศัพท์มือถือระบบ CDMA และในส่วนของโมดูลอื่น ๆ เพื่อรองรับเทคโนโลยีในปัจจุบันได้
ต่อไปอีก"
ระบบเตือนภัยการโจรกรรมรถยนต์ด้วยโทรศัพท์มือถือ,Car theft alert system using mobile,บัณฑิต ,พิมพากรณ์,นฤมล,ธัญญะประเสริฐศิริ,,,วิทวัส ทิพย์สุวรรณ,,,E-PROJECT,ปริญญานิพนธ์ (ค.อ.บ.),SW,ภาควิชาคอมพิวเตอร์ศึกษา,2552,"โจรกรรมรถยนต์ การป้องกัน เครื่องมือและอุปกรณ์
โทรศัพท์เคลื่อนที่
ระบบเตือนภัย"
การพัฒนาเว็บสนับสนุนเพื่อการทบทวนบทเรียนวิชาการเขียนโปรแกรมบระบบปฏิบัติการเท็กซ์โหมดหลักสูตรประกาศนียบัตรวิชาชีพ สำนักงานคณะกรรมการอาชีวศึกษา,The development of web support for text mode operating system programming,เบญจมาศ,ชูศรี,นงนุช,แก้วคำ,,,วิทวัส ทิพย์สุวรรณ,,,E-PROJECT,ปริญญานิพนธ์ (ค.อ.บ.),WBI,ภาควิชาคอมพิวเตอร์ศึกษา,2552,"การพัฒนาเว็บไซต์ โปรแกรมคอมพิวเตอร์
การเรียนการสอนผ่านเว็บ การศึกษาและการสอน (อาชีวศึกษา)
แบบเรียนสำเร็จรูป
สื่อการสอน การออกแบบและการสร้าง"
การพัฒนาบทเรียนคอมพิวเตอร์ช่วยสอนประกอบชุดทคลอง,A Development of Computer Assisted Instruction Interfacing with Experiment Set using USB port on Magnetic Field,กนกศักดิ์,ศรีเมฆ,ธีร์รัฐ,นิธิพัฒน์รัฐ,,,วิทวัส ทิพย์สุวรรณ,,,E-PROJECT,ปริญญานิพนธ์ (ค.อ.บ.),CAI,ภาควิชาคอมพิวเตอร์ศึกษา,2553,"โครงงานครั้งนี้มีวัตถุประสงค์เพื่อออกแบบและสร้างสื่อบทเรียนคอมพิวเตอร์ช่วยสอน
ประกอบชุดทดลองผ่านพอร์ตยูเอสบี เรื่อง สนามแม่เหล็ก ผู้จัดทำโครงงานแบ่งขอบเขตของ
เนื้อหาโครงงานเป็น 3 หัวข้อ ได้แก่ กรเกิดสนามแม่เหล็กรอบตัวนำที่มีกระแสไฟฟ้าไหลผ่าน ชุด
ทดลองสนามแม่เหล็กของขดลวด และชุดทดลองตัวนำที่มีกระแสไหลผ่านซึ่งอยู่ในสนามแม่เหล็ก
จากนั้น นำบทเรียนไปออกแบบและสร้างสื่อบทเรียนคอมพิวเตอร์ช่วยสอนประกอบชุดทดลองผ่าน
พอร์ตยูเอสบี เรื่อง สนามแม่เหล็ก ตามขั้นตอน โดยเริ่มจากออกแบบและสร้างวงจรในส่วนของ
ฮาร์ดแวร์ ออกแบบโปรแกรมติดต่อระหว่างคอมพิวเตอร์และกล่องควบคุม ออกแบบโปรแกรมการ
ทดลอง ออกแบบบทเรียนคอมพิวเตอร์ช่วยสอน และทำการทดลอง CAI ร่วมกับชุดทดลองผ่านทาง
พอร์ต USB จุ ผลการดำเนินโครงงานแบ่งออกเป็น 3 ส่วนคือ 1.ผลการออกแบบและสร้างวงจรใน
ส่วนของชาร์ดแวร์ โดขแบ่งออกเป็น 2 ส่วน คือ กล่องควบคุมใช้ติดต่อรับค่าจากพอร์ต USB ของ
คอมพิวเตอร์และชุดทดลอง 2.ผลการเขียนโปรแกรมติดต่อกับอุปกรณ์ภายนอก ได้โปรแกรมการ
ทดลองที่สร้างจาก Visual Basic 3.บทเรียนคอมพิวเตอร์ช่วยสอนเรื่องสนามแม่เหล็ก โครงงานนี้
ผู้เรียนสามารถเรียนรู้ทฤษฎีจ าก CAI และสามารถทำการทดลองบนหน้าจอคอมพิวเตอร์ต่อได้ทันที
เห็นผลการปฏิบัติชัดเจน เกิดการเรียนรู้อย่างถ่องแท้และติดทน สัมฤทธิ์ผลทางกระบวนการเรียน
การสอนได้เป็นอย่างดี"
การพัฒนาระบบจัดการความรู้สนับสนุนช่วยเหลือการจัดทำเอกสารแจ้งซ่อมการทำงานของคอมพิวเตอร์แบบออนไลน์ของ บริษัท ไทยสมุทรประกันชีวิต จำกัด,"The Development of Knowledge Management System for Supporting the prepared documents approach computer form online of Ocean Life Insurance Co.,Ltd.",กมลรัตน์ ,ศรีเจริญ,,,,,วิทวัส ทิพย์สุวรรณ,,,E-PROJECT,ปริญญานิพนธ์ (ค.อ.บ.),SW,ภาควิชาคอมพิวเตอร์ศึกษา,2553,การวิจัยครั้งนี้มีวัตถุประสงค์ เพื่อพัฒนา และหาความพึงพอไจของระบบจัดการความรู้ สนับสนุนช่วยเหลือการจัดทำเอกสารแจ้งซ่อมการทำงานของคอมพิวเตอร์แบบออนไลน์ของบริษัท ไทยสมุทรประกันชีวิต จำกัด  กลุ่มทดลองใช้พนักงานของบริษัท ไทยสมุทรประกันชีวิต จำกัด จำนวน 30 ท่าน โดยเลือกแบบเจาะจง เครื่องมือที่ใช้ในการวิจัยครั้งนี้คือ ระบบจัดการความรู้สนับสนุนช่วยเหลือการจัดทำอกสารแจ้งซ่อมการทำงานของคอมพิวเตอร์แบบออนไลน์  และ แบบประเมินความพึงพอใจของผู้ใช้งานระบบที่ผู้วิจัยพัฒนาขึ้น ผลกา วิจัยพบว่าการใช้งานระบบจัดการความรู้สนับสนุนช่วยเหลือการจัดทำเอกสารแจ้งซ่อมการทำงานของคอมพิวเตอร์แบบออนไลน์ ในครั้งนี้ผู้ใช้งานระบบมีความพึงพอใจอยู่ในระดับ มาก ระบบจัดการความรู้สนับสนุนช่วยเหลือการจัดทำเอกสารแจ้งซ่อมการทำงานของคอมพิวเตอร์แบบออนไลน์นั้น สามารถนำไปใช้งานได้จริง หรือใช้เป็นต้นแบบกรณีศึกษา เพื่อพัฒนาระบบอื่นต่อไป
การพัฒนาบทเรียนคอมพิวเตอร์ช่วยฝากอบรมพนักงานใหม่ที่ให้บริการลูกค้าทางโทรศัพท์ของบริษัท ทรูทัช จํากัด,The Development of Computer-Assisted Training for New Employees Serving Customers via Phone at True Touch Company,ปุณยากร ,เหล่าวัฒนพงศ์,,,,,วิทวัส ทิพย์สุวรรณ,,,E-PROJECT,ปริญญานิพนธ์ (ค.อ.บ.),WBI,ภาควิชาคอมพิวเตอร์ศึกษา,2553,"การวิจัยครั้งนี้มีวัตถุประสงค์ เพื่อพัฒนาและหาประสิทธิภาพบทเรียนคอมพิวเตอร์ช่วย
ฝึกอบรมพนักงานใหม่ที่ให้บริการลูกค้าทางโทรศัพท์ของ บริษัท ทรู ทัช จำกัดและ
เพื่อเปรียบเทียบผลสัมฤทธิ์การฝึกอบรมระหว่างกลุ่มที่ได้รับฝึกอบรมด้วยบทเรียนคอมพิวเตอร์
ช่วยฝึกอบรมพนักงานใหม่ที่ให้บริการลูกค้าทางโทรศัพท์ของ บริษัท ทรู ทัช จำกัด กับกลุ่มที่
ได้รับฝึกอบรมแบบปกติ กลุ่มตัวอย่างที่ใช้ในการวิจัย คือ พนักงานใหม่ที่ให้บริการลูกค้า
ทางโทรศัพท์ของบริษัท ทรู ทัช จำกัด ประจำปี 2554 จำนวน 40 คน เครื่องมือที่ใช้ในการวิจัย
ในครั้งนี้ได้แก่ บทเรียนคอมพิวเตอร์ช่วยฝึกอบรมพนักงานใหม่ที่ให้บริการลูกาทางโทรศัพท์
แบบทดสอบหลังฝึกอบรม การวิเคราะห์ข้อมูลโดยใช้สถิติพื้นฐาน ได้แก่ ค่าเฉลี่ยและ
ค่าเบี่ยงเบนมาตรฐาน และการทดสอบค่ที่ (t-test แบบ Independent Sample Group)
ผลการวิจัยครั้งนี้พบว่าบทเรียนคอมพิวเตอร์ช่วยฝึกอบรมดังกล่าวมีประสิทธิภาพ 1.17
ซึ่งสูงกว่าเกณฑ์เมกุยแกนส์ 1.0 ที่ตั้งสมมติฐานไว้ และผลสัมฤทธิ์ทางการเรียนของผู้เข้ารับการ
ฝึกอบรม พบว่าผลสัมฤทธิ์ทางการฝึกอบรมหลังฝึกอบรมสูงกว่าก่อนฝึกอบรมอย่างมีนัยสำคัญ
ทางสถิติ .05 นอกจากนี้แล้วความพึงพอใจของผู้ใช้บทเรียนคอมพิวเตอร์ซ่วยฝึกอบรมอยู่ใน
ระดับดี ( X =4.29, S.D.=0.52) สรุปได้ว่า บทเรียนคอมพิวเตอร์ช่วยฝึกอบรมพนักงานใหม่
ที่ให้บริการลูกค้าทางโทรศัพท์ของ บริษัท ทรู ทัช จำกัด สามารถนำไปใช้ฝึกอบรมได้"
